"","park","year","total_sq_kilometers","country","state_region_province","closest_city","distance_from_closest_city","geocode_address","lon","lat","geoAddress"
"271","Western Pomerania Lagoon Area ",1990,"805","Germany","Mecklenberg-Lower Pomerania","Rostock",53,"Western Pomerania Lagoon Area  National Park, Germany",12.9431219,54.4367417,"vorpommersche boddenlandschaft national park, im forst 5, 18375 born a. darß, germany"
"272","Hainich",1997,"75","Germany","Thuringia","Kassel",97,"Hainich National Park, Germany",10.4342391,51.0804143,"hainich national park, bei der marktkirche 9, 99947 bad langensalza, germany"
"273","Eifel",2004,"107","Germany","North Rhine-Westphalia","Aachen",38,"Eifel National Park, Germany",6.425929,50.5973902,"eifel national park, germany"
"274","Kellerwald-Edersee ",2004,"57","Germany","Hesse","Kassel",65,"Kellerwald-Edersee  National Park, Germany",9.1033333,51.0272222,"kellerwald, 34632 jesberg, germany"
"275","Harz ",2006,"247","Germany","Saxony-Anhalt and Saxony","Gottingen",56,"Harz  National Park, Germany",10.5231907,51.7798662,"harz national park, germany"
"276","Black Forest ",2014,"101","Germany","Baden-Wurttemberg","Strasbourg",59,"Black Forest  National Park, Germany",8.2703877,48.5775211,"schwarzwald national park, schwarzwaldhochstraße 2, 77889 seebach, germany"
"277","Hunsruck-Hochwald ",2015,"100","Germany","Rhineland-Palatinate and Saarland","Saarbrucken ",66,"Hunsruck-Hochwald  National Park, Germany",7.0674843,49.6935931,"hunsrück-hochwald national park, unnamed road, 54422 börfink, germany"
"278","Hortobagy",1973,"810","Hungary","Great Plain","Debrecen",24,"Hortobagy National Park, Hungary",21.0915786,47.5225431,"hortobágyi national park, hungary"
"279","Kiskunsag",1975,"506","Hungary","Great Plain","Kecskemet",25,"Kiskunsag National Park, Hungary",19.400018,46.8833159,"fülöpháza, kiskunság national park, 6042 hungary"
"280","Bukk",1977,"423","Hungary","Northern Uplands","Miskolc",57,"Bukk National Park, Hungary",20.4037901,48.0556308,"répáshuta, bükki national park, 3559 hungary"
"281","Aggtelek",1985,"202","Hungary","Northern Uplands","Miskolc",46,"Aggtelek National Park, Hungary",20.5400313,48.5080267,"aggtelek national park, hungary"
"282","Ferto-Hansag ",1991,"239","Hungary","Transdanubia","Bratislava",80,"Ferto-Hansag  National Park, Hungary",16.8635688,47.6386776,"sarród, fertő-hanság national park, rév-kócsagvár 4, 9435 hungary"
"283","Danube-Drava ",1996,"498","Hungary","Transdanubia","Pecs",56,"Danube-Drava  National Park, Hungary",18.7488605,45.9391182,"mohács, duna-dráva national park, cselepatak u. 43, 7700 hungary"
"284","Balaton Uplands ",1997,"570","Hungary","Lake Baloton and the Bakony","Budapest",143,"Balaton Uplands  National Park, Hungary",17.6770482,46.8950755,"csopak, balaton uplands national park, kossuth utca 16, 8229 hungary"
"285","Danube-Ipoly",1997,"607","Hungary","Danube Bend","Budapest",79,"Danube-Ipoly National Park, Hungary",18.8941551,47.8943839,"nagybörzsöny, danube-ipoly national park, 2634 hungary"
"286","Koros-Maros ",1997,"512","Hungary","Great Plain","Kecskemet",80,"Koros-Maros  National Park, Hungary",20.5266716,46.8574868,"szarvas, körös-maros national park, annaliget 1, 5540 hungary"
"287","Orseg",2002,"440","Hungary","Transdanubia","Graz",103,"Orseg National Park, Hungary",16.4170109,46.8414481,"őriszentpéter, őrség national park, városszer 57, 9941 hungary"
"288","Þingvellir ",1930,"240","Iceland","S Iceland","Reykjavik",47,"Þingvellir  National Park, Iceland",-21.1295496,64.2559196,"þingvellir national park, þingvellir, 801, 806 selfoss, iceland"
"289","Snæfellsjökull",2001,"170","Iceland","W Iceland","Reykjavik",197,"Snæfellsjökull National Park, Iceland",-23.7730967,64.8057023,"snæfellsjökull, iceland"
"290","Vatnajökull",2008,"13,952","Iceland","SE Iceland","Reykjavik",320,"Vatnajökull National Park, Iceland",-17.2091077,64.7843002,"vatnajökull national park, klapparstígur 25, 101 27, iceland"
"291","Connemara",1980,"20","Ireland","Galway and Mayo","Cork",285,"Connemara National Park, Ireland",-9.8875419,53.5383782,"connemara national park, letterfrack, co. galway, ireland"
"292","Glenveagh",1984,"170","Ireland","Donegal","Belfast",171,"Glenveagh National Park, Ireland",-7.9376869,55.0575877,"glenveagh national park, letterkenny, co. donegal, ireland"
"293","The Burren ",1991,"15","Ireland","Limerick and Clare","Cork",154,"The Burren  National Park, Ireland",-9.0373606,52.9968282,"burren national park, 2 church street, corofin, co. clare, v95 t9v6, ireland"
"294","Wicklow Mountains ",1991,"205","Ireland","Around Dublin","Dublin",22,"Wicklow Mountains  National Park, Ireland",-6.3938595,53.0818051,"wicklow mountains, laragh west, co. wicklow, ireland"
"295","Wild Nephin ",1998,"150","Ireland","Galway and Mayo","Dublin",265,"Wild Nephin  National Park, Ireland",-9.8233278,54.0244585,"ballycroy visitor centre - wild nephin national park, ballycroy, co. mayo, ireland"
"296","Killarney",1932,"105","Ireland`","Kerry","Cork",85,"Killarney National Park, Ireland`",-9.5561803,52.0058447,"killarney national park, co. kerry, ireland"
"297","Gran Paradiso ",1922,"700","Italy","Piemonte and Valle d’Aosta","Turin",147,"Gran Paradiso  National Park, Italy",7.3244838,45.5220276,"gran paradiso national park, italy"
"298","Abruzzo, Lazio and Molise ",1923,"507","Italy","Abruzzo and Molise","Pescara",114,"Abruzzo, Lazio and Molise  National Park, Italy",13.7900817,41.8088069,"national park of abruzzo, italy"
"299","Circeo",1934,"84","Italy","Rome and Lazio","Latina",8,"Circeo National Park, Italy",12.916487,41.3977742,"parco nazionale del circeo, str. di fogliano, 04100 latina lt, italy"
"300","Stelvio",1935,"1307","Italy","Lombardy and Trentino-Alto Adige","Bolzano Bozen",63,"Stelvio National Park, Italy",10.5339141,46.4556321,"parco nazionale dello stelvio, via alberto de simoni, 42, 23032 bormio so, italy"
"301","Dolomiti Bellunesi ",1988,"32","Italy","Veneto","Trento",90,"Dolomiti Bellunesi  National Park, Italy",12.036645,46.169919,"parco nazionale delle dolomiti bellunesi, dolomiti bellunesi, belluno bl, italy"
"302","Pollino",1988,"1926","Italy","Calabria and Basilicata","Taranto",183,"Pollino National Park, Italy",16.122265,39.94133,"pollino national park, italy"
"303","Sibillini Mountains ",1988,"697","Italy","Marche and Umbria","Terni ",65,"Sibillini Mountains  National Park, Italy",13.2201828,42.9078391,"parco nazionale dei monti sibillini, italy"
"304","Aspromonte",1989,"761","Italy","Calabria and Basilicata","Reggio Calabria",33,"Aspromonte National Park, Italy",15.8904785,38.165354,"aspromonte national park, 89057 santo stefano in aspromonte rc, italy"
"305","Foreste Casentinesi, Monte Falterona and Campigna",1989,"364","Italy","Emilia-Romagna and Tuscany","Forli",47,"Foreste Casentinesi, Monte Falterona and Campigna National Park, Italy",11.745409,43.8724003,"47018 campigna, province of forlì-cesena, italy"
"306","Tuscan Archipelago ",1989,"747","Italy","Emilia-Romagna and Tuscany","Livorno",137,"Tuscan Archipelago  National Park, Italy",10.2714331975294,42.7963950452334,"tuscan archipelago, province of livorno, italy"
"307","Cilento, Valle di Diano and Alburni ",1991,"1810","Italy","Campania","Salerno",64,"Cilento, Valle di Diano and Alburni  National Park, Italy",15.316667,40.55,"alburni, 84029 sicignano degli alburni, sa, italy"
"308","Gargano",1991,"1221","Italy","Puglia","Foggia",29,"Gargano National Park, Italy",15.8516421,41.7817081,"gargano national park, provincia di foggia, italy"
"309","Gran Sasso and Monti della Laga ",1991,"1413","Italy","Marche, Rome and Lazio, Abruzzo and the Molise","Terni ",101,"Gran Sasso and Monti della Laga  National Park, Italy",13.4974258,42.490648,"parco nazionale del gran sasso e monti della laga, italy"
"310","Majella",1991,"704","Italy","Abruzzo and the Molise","Pescara",69,"Majella National Park, Italy",14.0891746,42.0762743,"majella national park, 67030 pacentro aq, italy"
"311","Val Grande ",1991,"146","Italy","Piemonte and Valle d’Aosta","Novara",81,"Val Grande  National Park, Italy",12.56738,41.87194,"italy"
"312","Vesuvius",1991,"73","Italy","Campania","Naples",14,"Vesuvius National Park, Italy",14.4258522,40.8281756,"vesuvio national park, città metropolitana di napoli, italy"
"313","Archipelago of La Maddalena ",1994,"201","Italy","Sardinia","Cagliari",305,"Archipelago of La Maddalena  National Park, Italy",9.43650715,41.2322907,"maddalena archipelago, italy"
"314","Apennino Tosco-Emiliano ",1997,"228","Italy","Emilia-Romagna and Tuscany","Livorno",106,"Apennino Tosco-Emiliano  National Park, Italy",10.2876983,44.3805925,"riserva mab appennino tosco-emiliano, via val d'enza, 31a, 42020 vetto re, italy"
"315","Asinara",1997,"270","Italy","Sardinia","Cagliari",284,"Asinara National Park, Italy",8.2740757,41.0643764,"asinara national park, 07046 asinara ss, italy"
"316","Sila",1997,"737","Italy","Calabria and Basilicata","Reggio Calabria",251,"Sila National Park, Italy",16.6099337,39.4496596,"sila national park, 87066 longobucco cs, italy"
"317","Gennargentu",1998,"730","Italy","Sardinia","Cagliari",146,"Gennargentu National Park, Italy",9.3851236,40.0728658,"parco nazionale del golfo di orosei e del gennargentu, provincia di nuoro, italy"
"318","Cinque Terre ",1999,"39","Italy","Liguria","Genoa",84,"Cinque Terre  National Park, Italy",9.7123907,44.128109,"cinque terre national park, provincia della spezia, italy"
"319","Alta Murgia ",2004,"677","Italy","Puglia","Bari",53,"Alta Murgia  National Park, Italy",16.418526,40.8144771,"via firenze, 10, 70024 gravina in puglia ba, italy"
"320","Apennino Lucano-Val d’Agri-Lagonegrese",2007,"690","Italy","Calabria and Basilicata","Salerno",109,"Apennino Lucano-Val d’Agri-Lagonegrese National Park, Italy",15.8725864,40.3585491,"ente parco nazionale dell'appennino lucano val d'agri - lagonegrese, 85052 pz, italy"
"321","Island of Pantelleria ",2016,"66","Italy","Sicily","Palermo",281,"Island of Pantelleria  National Park, Italy",11.9918779,36.785262,"pantelleria, 91017 pantelleria, free municipal consortium of trapani, italy"
"322","Bjeshket e Nemuna ",2012,"630","Kosovo","Kosovo","Pristina",121,"Bjeshket e Nemuna  National Park, Kosovo",20.1879106,42.6234144,"j5fq+957 national park prokletije, shtupeq i vogël"
"323","Sharr Mountains ",2012,"533","Kosovo","Kosovo","Pristina",70,"Sharr Mountains  National Park, Kosovo",20.9443443,42.2054079,"sharr mountain national park"
"324","Gauja",1973,"918","Latvia","Vidzeme","Riga",94,"Gauja National Park, Latvia",25.2123009,57.3320554,"gauja national park, lielā iela 30, ieriķi, lv-4139, latvia"
"325","Kemeri ",1997,"362","Latvia","Courland, Semigallia and Vidzeme","Riga",46,"Kemeri  National Park, Latvia",23.4603061,56.9453376,"ķemeri national park, pavasari, salas pagasts, latvia"
"326","Slitere ",1999,"164","Latvia","Courland","Riga",179,"Slitere  National Park, Latvia",22.4133863,57.6935779,"slītere national park, latvia"
"327","Razna",2007,"596","Latvia","Latgale","Riga",276,"Razna National Park, Latvia",27.4790249,56.2670966,"rāznas nacionālais parks, rāznas iela 10, lipuški, lv-4626, latvia"
"328","Aukstaitija",1974,"411","Lithuania","Aukstaitija","Vilnius",118,"Aukstaitija National Park, Lithuania",26.0569303,55.3439098,"aukštaitija national park, ignalinos sen, 30202, lithuania"
"329","Dzukija",1981,"585","Lithuania","Dzukija","Vilnius",104,"Dzukija National Park, Lithuania",24.1861435,54.1631752,"dzūkijos nacionalinio parko ir čepkelių valstybinio gamtinio rezervato direkcija, vilniaus g. 3, 65334 merkinė, lithuania"
"330","Curonian Spit ",1991,"274","Lithuania","Lithuania Minor","Klapeida",51,"Curonian Spit  National Park, Lithuania",20.9904538,55.2950183,"curonian spit national park, naglių g. 8, 93123 nida, lithuania"
"331","Trakai National Historic Park ",1991,"81","Lithuania","Dzukija","Vilnius",30,"Trakai National Historic Park  National Park, Lithuania",24.9332958,54.6478878,"trakai historical national park, karaimų g. 5, 21104 trakai, lithuania"
"332","Zemaitija",1991,"218","Lithuania","Samogitia","Klapeida",74,"Zemaitija National Park, Lithuania",21.8531667,56.033622,"žemaitijos nacionalinis parkas, didžioji gatvė 10, 90420 plateliai, lithuania"
"333","Orhei ",2013,"388","Moldova","Central Moldova","Chisinau",53,"Orhei  National Park, Moldova",28.9789795,47.3036244,"orhei national park, orhei vechi monastery rd, butuceni, moldova"
"334","Durmitor",1952,"390","Montenegro","NW Montenegro","Sarajevo ",152,"Durmitor National Park, Montenegro",19.0895813,43.149618,"43xq+rrw durmitor, žabljak, montenegro"
"335","Biogradska Gora ",1952,"57","Montenegro","NE Montenegro","Mitrovica",199,"Biogradska Gora  National Park, Montenegro",19.6103673,42.8920363,"biogradska gora, montenegro"
"336","Lovcen",1952,"62","Montenegro","S Montenegro","Shkoder",115,"Lovcen National Park, Montenegro",18.8432656,42.397607,"9rxv+28r lovcen national park, cetinje, montenegro"
"337","Lake Skadar ",1983,"400","Montenegro","SE Montenegro","Shkoder",71,"Lake Skadar  National Park, Montenegro",19.2914983,42.1837016,"shkodra lake"
"338","Prokletije",2009,"166","Montenegro","E Montenegro","Prizren (Kosovo)",151,"Prokletije National Park, Montenegro",19.9139594,42.5319022,"nacionalni park prokletije, za hrid, treskavica, montenegro"
"339","Veluwezoom",1930,"50","Netherlands","Eastern Netherlands","Arnhem",11,"Veluwezoom National Park, Netherlands",6.0198869,52.0483103,"national park veluwezoom, heuvenseweg 5a, 6991 je rheden, netherlands"
"340","De Hoge Veluwe ",1935,"54","Netherlands","Eastern Netherlands","Arnhem",10,"De Hoge Veluwe  National Park, Netherlands",5.8324892,52.078716,"hoge veluwe national park, netherlands"
"341","Schiermonnikoog",1989,"54","Netherlands","North and Frisian Islands","Groningen",39,"Schiermonnikoog National Park, Netherlands",6.1614581,53.4774159,"schiermonnikoog national park, reeweg 9, 9166 pw schiermonnikoog, netherlands"
"342","Dwingelderveld",1991,"37","Netherlands","North and Frisian Islands","Zwolle",50,"Dwingelderveld National Park, Netherlands",6.4093855,52.8087147,"dwingelderveld national park, benderse 22, 7963 ra ruinen, netherlands"
"343","Weeribben-Wieden ",1992,"105","Netherlands","Eastern Netherlands","Zwolle",35,"Weeribben-Wieden  National Park, Netherlands",6.0282352,52.7256321,"de weerribben-wieden national park, oeverweg, giethoorn, netherlands"
"344","De Groote Peel ",1993,"13","Netherlands","South and Zeeland","Eindhoven",31,"De Groote Peel  National Park, Netherlands",5.8173712,51.3465447,"de groote peel national park, moostdijk 15, 6035 rb ospel, netherlands"
"345","De Biesboch ",1994,"71","Netherlands","South and Zeeland","Dordrecht",7,"De Biesboch  National Park, Netherlands",4.7632307,51.7507546,"nationaal park de biesbosch, netherlands"
"346","Zuid-Kennemerland ",1995,"38","Netherlands","Noord-Holland","Haarlem",5,"Zuid-Kennemerland  National Park, Netherlands",4.5921277,52.3960551,"zuid-kennemerland national park, zeeweg 12, 2051 ec overveen, netherlands"
"347","De Meinweg ",1995,"17","Netherlands","South and Zeeland","Eindhoven",62,"De Meinweg  National Park, Netherlands",6.0847487,51.1560745,"meinweg national park, meinweg 2, 6075 na herkenbosch, netherlands"
"348","De Maasduinen ",1996,"42","Netherlands","South and Zeeland","Nijmegen",44,"De Maasduinen  National Park, Netherlands",6.0985098,51.5831114,"national park de maasduinen, bergen, netherlands"
"349","Drents-Friese Wold ",2000,"61","Netherlands","North and Frisian Islands","Groningen",56,"Drents-Friese Wold  National Park, Netherlands",6.3104433,52.8800076,"drents-friese wold national park, 8426 sj diever, netherlands"
"350","De Zoom-Kalmthoutse ",2001,"38","Netherlands","South and Zeeland","Antwerp",24,"De Zoom-Kalmthoutse  National Park, Netherlands",4.4076193,51.3995901,"grenspark kalmthoutse heide, putsesteenweg 129, 2920 kalmthout, belgium"
"351","Drentsche Aa ",2002,"106","Netherlands","North and Frisian Islands","Groningen",27,"Drentsche Aa  National Park, Netherlands",6.6418091,53.0823743,"nationaal beek- en esdorpenlandschap drentsche aa, zuidlaarderweg 37, 9482 tv tynaarlo, netherlands"
"352","Duinen van Texel ",2002,"43","Netherlands","Noord-Holland","Amsterdam",102,"Duinen van Texel  National Park, Netherlands",4.7433419,53.0752289,"nationaal park duinen van texel, ruijslaan 92, 1796 az de koog, netherlands"
"353","Oosterschelde",2002,"370","Netherlands","South and Zeeland","Antwerp",70,"Oosterschelde National Park, Netherlands",3.9486301,51.569722,"oosterschelde national park, netherlands"
"354","De Loonse en Drunense Duinen ",2002,"34","Netherlands","South and Zeeland","‘s-Hertogenbosch ",12,"De Loonse en Drunense Duinen  National Park, Netherlands",5.1318331,51.6533754,"the loonse and drunense duinen nat'l pk, 5151 rg drunen, netherlands"
"355","Lauwersmeer",2003,"60","Netherlands","North and Frisian Islands","Groningen",46,"Lauwersmeer National Park, Netherlands",6.1730238,53.3744179,"nationaal park lauwersmeer, nationaal park lauwersmeer, lauwersoog 9976 vt, de rug 1, 9976 vt lauwersoog, netherlands"
"356","Utrechtse Heuvelrug ",2003,"100","Netherlands","Zuid-Holland and Utrecht","Utrecht",24,"Utrechtse Heuvelrug  National Park, Netherlands",5.3539877,52.0495308,"utrechtse heuvelrug national park, amersfoortseweg 98, 3941 ep doorn, netherlands"
"357","Sallandse Heuvelrug ",2004,"27","Netherlands","Eastern Netherlands","Zwolle",37,"Sallandse Heuvelrug  National Park, Netherlands",6.4184451,52.3469049,"sallandse heuvelrug, netherlands"
"358","De Alde Feanen ",2006,"40","Netherlands","North and Frisian Islands","Groningen",56,"De Alde Feanen  National Park, Netherlands",5.944981,53.129885,"de alde feanen national park, koaidyk 8a, 9264 tp earnewald, netherlands"
"359","Nieuw Land ",2018,"289","Netherlands","Eastern Netherlands","Almere",17,"Nieuw Land  National Park, Netherlands",5.4251703,52.5276298,"nationaal park nieuw land, visarenddreef, 8232 ph lelystad, netherlands"
"360","Pelister",1948,"172","North Macedonia","Southern N Macedonia","Elbasan",169,"Pelister National Park, North Macedonia",21.2129616,41.0014546,"2627+h5p national park „pelister“, nižepole, north macedonia"
"361","Mavrovo",1949,"780","North Macedonia","Western N Macedonia","Skopje",99,"Mavrovo National Park, North Macedonia",20.7338513,41.6549405,"mavrovo, north macedonia"
"362","Galicica",1958,"227","North Macedonia","Southern N Macedonia","Elbasan",92,"Galicica National Park, North Macedonia",20.8327778,40.9641667,"galičica, north macedonia"
"363","Shar Mountain",2021,"627","North Macedonia","NW N Macedonia","Skopje",63,"Shar Mountain National Park, North Macedonia",20.8333333,42.0833333,"šar mountains, north macedonia"
"364","Rondane",1962,"963","Norway","Central Norway","Trondheim",257,"Rondane National Park, Norway",9.7888809,61.9315164,"rondane national park, norway"
"365","Borgefjell",1963,"1446","Norway","Trondheim to the Lofoten Islands","Trondheim",350,"Borgefjell National Park, Norway",13.9535612,65.0623706,"børgefjell/byrkije nasjonalpark, børgefjell, 7898 limingen, norway"
"366","Gutulia",1968,"23","Norway","Central Norway","Oslo",308,"Gutulia National Park, Norway",12.1756405,62.0254161,"gutulia, 2443 drevsjø, norway"
"367","Anderdalen",1970,"134","Norway","North Norway","Murmansk",950,"Anderdalen National Park, Norway",17.2481834,69.207934,"ånderdalen national park, senja, norway"
"368","Ovre Pasvik ",1970,"199","Norway","North Norway","Murmansk",256,"Ovre Pasvik  National Park, Norway",29.2315988,69.1499347,"øvre pasvik nasjonalpark, fv8850 1, 9925 svanvik, norway"
"369","Stabbursdalen",1970,"747","Norway","North Norway","Murmansk",470,"Stabbursdalen National Park, Norway",24.5110167,69.9952006,"stabbursdalen national park, vestre porsangerveien 1335, 9710 indre billefjord, norway"
"370","Femundsmarka",1971,"573","Norway","Central Norway","Trondheim",320,"Femundsmarka National Park, Norway",12.151693,62.3193251,"femundsmarka national park, synnervika 59, 7375, norway"
"371","Ovre Dividal ",1971,"750","Norway","North Norway","Oulu",650,"Ovre Dividal  National Park, Norway",19.9612872,68.7348814,"øvre dividal national park, målselv, norway"
"372","Rago",1971,"171","Norway","Trondheim to the Lofoten Islands","Trondheim",649,"Rago National Park, Norway",16.0056756,67.4385104,"rago national park, sørfold, norway"
"373","Forlandet",1973,"4647","Norway","North Norway","Murmansk",1247,"Forlandet National Park, Norway",8.468946,60.472024,"norway"
"374","Nordvest-Spitzbergen ",1973,"9914","Norway","North Norway","Murmansk",1307,"Nordvest-Spitzbergen  National Park, Norway",8.468946,60.472024,"norway"
"375","Sor-Spitsbergen ",1973,"13286","Norway","North Norway","Murmansk",1063,"Sor-Spitsbergen  National Park, Norway",8.468946,60.472024,"norway"
"376","Dovrefjell-Sunndallsfjella ",1974,"4367","Norway","Central Norway","Trondheim",142,"Dovrefjell-Sunndallsfjella  National Park, Norway",9.106266,62.3662329,"dovrefjell–sunndalsfjella national park, norway"
"377","Ovre Anarjohka ",1975,"1390","Norway","North Norway","Murmansk",577,"Ovre Anarjohka  National Park, Norway",24.6887897,68.767119,"øvre anárjohka nasjonalpark, kautokeino kommune, norway"
"378","Jotunheimen",1980,"1151","Norway","Central Norway","Trondheim",309,"Jotunheimen National Park, Norway",8.484206,61.5535919,"jotunheimen national park, norway"
"379","Hardangervidda",1981,"3422","Norway","Bergen and the Western Fjords","Bergen",177,"Hardangervidda National Park, Norway",7.443046,60.1542843,"hardangervidda national park, norway"
"380","Reisa",1986,"803","Norway","North Norway","Trondheim",251,"Reisa National Park, Norway",21.7173781,69.4023654,"reisa national park, hovedveien 2, 9151 storslett, norway"
"381","Saltfjellet-Svartisen ",1989,"2192","Norway","Trondheim to the Lofoten Islands","Trondheim",490,"Saltfjellet-Svartisen  National Park, Norway",14.5385458,66.6484076,"saltfjellet–svartisen national park, rana, norway"
"382","Jostedalsbree",1991,"1310","Norway","Bergen and the Western Fjords","Bergen",298,"Jostedalsbree National Park, Norway",8.468946,60.472024,"norway"
"383","Forollhogna",2001,"1062","Norway","Central Norway","Trondheim",142,"Forollhogna National Park, Norway",10.7048034,62.6066125,"forollhogna national park, 2512 os i østerdalen, norway"
"384","Dovre",2003,"289","Norway","Central Norway","Trondheim",221,"Dovre National Park, Norway",8.468946,60.472024,"norway"
"385","Moysalen",2003,"51","Norway","North Norway","Oulu",801,"Moysalen National Park, Norway",15.489665,68.5032378,"møysalen, 8412, norway"
"386","Nordre Isfjorden ",2003,"2954","Norway","North Norway","Murmansk",1187,"Nordre Isfjorden  National Park, Norway",7.7922426,62.577801,"isfjorden, norway"
"387","Sassen-Bunsow Land ",2003,"1230","Norway","North Norway","Murmansk",1149,"Sassen-Bunsow Land  National Park, Norway",16.9755556,78.5472222,"bünsow land, 9170, svalbard and jan mayen"
"388","Blafjella-Skjaekerfjella ",2004,"1924","Norway","Trondheim to the Lofoten Islands","Trondheim",199,"Blafjella-Skjaekerfjella  National Park, Norway",13.1970355,64.263885,"blåfjella-skjækerfjella national park, snåsa kommune, norway"
"389","Junkerdal",2004,"682","Norway","Trondheim to the Lofoten Islands","Trondheim",649,"Junkerdal National Park, Norway",15.7453012,66.9211927,"junkerdal national park, junkerdal, norway"
"390","Lierne",2004,"333","Norway","Trondheim to the Lofoten Islands","Trondheim",295,"Lierne National Park, Norway",13.9670835,64.3274238,"lierne nasjonalpark / lijren vaarjelimmiedajve, 7882 nordli, norway"
"391","Skarvan and Roltdalen ",2004,"441","Norway","Trondheim to the Lofoten Islands","Trondheim",90,"Skarvan and Roltdalen  National Park, Norway",11.5172441,63.2328834,"skarvan og roltdalen, 7580, norway"
"392","Folgefonna ",2005,"545","Norway","Bergen and the Western Fjords","Bergen ",115,"Folgefonna  National Park, Norway",6.3333333,60,"folgefonna, etne municipality, norway"
"393","Indre Wijdefjorden ",2005,"1127","Norway","North Norway","Murmansk",1244,"Indre Wijdefjorden  National Park, Norway",8.468946,60.472024,"norway"
"394","Hallingskarvet",2006,"450","Norway","Central Norway","Oslo",240,"Hallingskarvet National Park, Norway",7.7378102,60.6144551,"hallingskarvet national park, rallarvegen 2660, 5719 finse, norway"
"395","Reinheimen ",2006,"1969","Norway","Bergen and the Western Fjords","Bergen",371,"Reinheimen  National Park, Norway",8.1373514,62.1647421,"reinheimen, 2668, norway"
"396","Seiland ",2006,"316","Norway","North Norway","Murmansk",408,"Seiland  National Park, Norway",23.3084379,70.3890901,"seiland national park, 9532 seiland, norway"
"397","Varangerhalvoy",2006,"1804","Norway","North Norway","Murmansk",385,"Varangerhalvoy National Park, Norway",29.5,70.4166667,"varanger peninsula, båtsfjord municipality, norway"
"398","Breihemen",2009,"1671","Norway","Bergen and the Western Fjords","Bergen",302,"Breihemen National Park, Norway",7.8584951,61.8037007,"breheimen, 2693, norway"
"399","Lomsdal-Visten ",2009,"682","Norway","Trondheim to the Lofoten Islands","Trondheim",350,"Lomsdal-Visten  National Park, Norway",12.9727997,65.4435658,"lomsdal–visten national park, 8960 velfjord, norway"
"400","Ytre Hvaler ",2009,"354","Norway","Oslo and the Oslofjord","Oslo",112,"Ytre Hvaler  National Park, Norway",11.0367137,59.0249855,"torvet 7, 1680 skjærhalden, norway"
"401","Sjunkhatten",2010,"417","Norway","Trondheim to the Lofoten Islands","Trondheim",701,"Sjunkhatten National Park, Norway",15.1747074,67.4070545,"sjunkhatten national park, ånsvikfjellet 3, 8220 røsvika, norway"
"402","Langsua",2011,"537","Norway","Central Norway","Oslo",193,"Langsua National Park, Norway",9.8146754,61.1945911,"langsua national park, 2653 vestre gausdal, norway"
"403","Rohkunborri",2011,"571","Norway","North Norway","Oulu",600,"Rohkunborri National Park, Norway",18.7943175,68.5477326,"rohkunborri national park, 9360 bardu, norway"
