"","park","year","total_sq_kilometers","country","state_region_province","closest_city","distance_from_closest_city","geocode_address","lon","lat","geoAddress"
"404","Fulufjellet ",2012,"83","Norway","Central Norway","Oslo",245,"Fulufjellet  National Park, Norway",12.777547,61.3976899,"fulufjellet national park, trysil, norway"
"405","Lakho",2012,"188","Norway","Trondheim to the Lofoten Islands","Trondheim",620,"Lakho National Park, Norway",14.2698089,66.829868,"láhko national park, 8120 nygårdsjøen, norway"
"406","Faerder",2013,"350","Norway","Oslo and the Oslofjord","Drammen",89,"Faerder National Park, Norway",10.4066938,59.0583812,"færder national park, helgerødveien 590, 3145 tjøme, norway"
"407","Jomfruland",2016,"177","Norway","Central Norway","Oslo",213,"Jomfruland National Park, Norway",9.5905535,58.8656363,"jomfruland national park, jomfruland, 3781 jomfruland, norway"
"408","Raet",2016,"607","Norway","The South","Drammen",247,"Raet National Park, Norway",8.468946,60.472024,"norway"
"409","Lofotodden",2018,"99","Norway","Trondheim to the Lofoten Islands","Trondheim",802,"Lofotodden National Park, Norway",13.087831,67.9323554,"lofotodden nasjonalpark, kirkeveien 52, 8390 reine, norway"
"410","Van Mijenfjorden ",2021,"4251","Norway","North Norway","Murmansk",1133,"Van Mijenfjorden  National Park, Norway",8.468946,60.472024,"norway"
"411","Bialowieza",1947,"105","Poland","Northeastern Poland","Bialystok",64,"Bialowieza National Park, Poland",23.6555674,52.7228852,"białowieża forest, poland"
"412","Swietokrzyski ",1950,"76","Poland","Krakow, Malopolska and the Tatras","Kielce",20,"Swietokrzyski  National Park, Poland",20.914549,50.896028,"swietokrzyski national park, suchedniowska 4, 26-010 bodzentyn, poland"
"413","Pieniny",1954,"23","Poland","Krakow, Malopolska and the Tatras","Krakow",111,"Pieniny National Park, Poland",20.3863415,49.4191992,"pieniński park narodowy, poland"
"414","Tatra",1954,"212","Poland","Krakow, Malopolska and the Tatras","Bielsko-Biala",129,"Tatra National Park, Poland",19.982744,49.271441,"tatry national park, poland, kuźnice 1, 34-500 zakopane, poland"
"415","Babia Gora ",1955,"34","Poland","Krakow, Malopolska and the Tatras","Bielsko-Biala ",71,"Babia Gora  National Park, Poland",19.531196,49.5937423,"babia góra national park, 34-223 zawoja, poland"
"416","Ojcow",1956,"21","Poland","Krakow, Malopolska and the Tatras","Krakow",20,"Ojcow National Park, Poland",19.8178761,50.2070516,"ojcowski national park, ojców 9, 32-045 sułoszowa, poland"
"417","Wielkopolska",1957,"76","Poland","Wielkopolska and Pomerania","Poznan",22,"Wielkopolska National Park, Poland",16.7972774,52.2687064,"wielkopolski national park, 62-050 jeziory, poland"
"418","Kampinos",1959,"385","Poland","Warsaw and Mazovia","Warsaw",15,"Kampinos National Park, Poland",20.6198094,52.3162506,"kampinos national park, izabelin c, poland"
"419","Karkonosze",1959,"56","Poland","Silesia","Walbrzych",57,"Karkonosze National Park, Poland",15.6370425,50.7874926,"karkonosze national park, chałubińskiego 23, 58-570 jelenia góra, poland"
"420","Wolin ",1960,"109","Poland","Wielkopolska and Pomerania","Szczecin",85,"Wolin  National Park, Poland",14.4860663,53.8973669,"wolin national park, 72-500 międzyzdroje, poland"
"421","Slowinski",1967,"186","Poland","Wielkopolska and Pomerania","Gdynia",116,"Slowinski National Park, Poland",17.3169313,54.7001729,"słowiński national park, bohaterów warszawy 1a, 76-214 smołdzino, poland"
"422","Bieszczady",1973,"292","Poland","Southeastern Poland","Rzeszow",149,"Bieszczady National Park, Poland",22.5904351,49.1411769,"bieszczady national park, 38-713 ustrzyki górne, poland"
"423","Roztocze",1974,"85","Poland","Southeastern Poland","Lublin",88,"Roztocze National Park, Poland",22.9628607,50.6001398,"roztocze national park, plażowa 2, zwierzyniec, poland"
"424","Gorce ",1981,"70","Poland","Krakow, Malopolska and the Tatras","Krakow",73,"Gorce  National Park, Poland",20.1509328,49.5503544,"gorczański park narodowy, poręba wielka 590, 34-735, poland"
"425","Wigry",1989,"151","Poland","Northeastern Poland","Grodno",97,"Wigry National Park, Poland",23.0098343,54.0842819,"wigierski park narodowy, krzywe 82, 16-402, poland"
"426","Drawno",1990,"144","Poland","Wielkopolska and Pomerania","Szczecin",115,"Drawno National Park, Poland",15.75932,53.21983,"drawno, poland"
"427","Polosie",1990,"98","Poland","Southeastern Poland","Lublin",56,"Polosie National Park, Poland",19.145136,51.919438,"poland"
"428","Biebrza",1993,"592","Poland","Northeastern Poland","Bialystok",55,"Biebrza National Park, Poland",22.7520131,53.4957878,"biebrzański park narodowy, poland"
"429","Stolowe Mountains ",1993,"63","Poland","Silesia","Walbrzych",56,"Stolowe Mountains  National Park, Poland",16.3958558,50.4601238,"stołowe mountains national park, poland"
"430","Magura",1995,"194","Poland","Southeastern Poland","Tarnow",90,"Magura National Park, Poland",21.4698347,49.5092526,"magura national park, 38-232 krempna, poland"
"431","Narew",1996,"68","Poland","Northeastern Poland","Bialystok",38,"Narew National Park, Poland",22.8686148,53.0727652,"narew national park, kurowo 10, 18-204, poland"
"432","Tuchola Forest ",1996,"48","Poland","Wielkopolska and Pomerania","Bygdoszcz",93,"Tuchola Forest  National Park, Poland",17.5648264,53.81517,"park narodowy bory tucholskie, długa 33, 89-606 charzykowy, poland"
"433","Ujscie Warty ",2001,"80","Poland","Wielkopolska and Pomerania","Gorzow Wielkopolski ",46,"Ujscie Warty  National Park, Poland",14.651084,52.5689319,"park narodowy „ujście warty"", chyrzyno 1, 69-113, poland"
"434","Cheile Bicazului-Hasmas ",1990,"66","Romania","Moldavia","Bacau",168,"Cheile Bicazului-Hasmas  National Park, Romania",25.8142645,46.8092782,"cheile bicazului, dn12c, romania"
"435","Piatra Craiului ",1990,"148","Romania","Transylvania","Brasov",51,"Piatra Craiului  National Park, Romania",25.2328077,45.503807,"g63m+g4 piatra craiului national park, ciocanu, romania"
"436","Calimani ",2000,"259","Romania","Transylvania","Botosani",168,"Calimani  National Park, Romania",25.351797,47.264653,"calimani national park, nr 54c, șaru dornei 727515, romania"
"437","Cozia",2000,"171","Romania","Wallachia","Sibiu",76,"Cozia National Park, Romania",24.2507056,45.3002454,"cozia national park, calea lui traian 559, căciulata 245601, romania"
"438","Domogled-Valea Cernei ",2000,"612","Romania","The Banat","Timisoara",193,"Domogled-Valea Cernei  National Park, Romania",22.4298417,44.9022354,"parcul național domogled-valea cernei, strada uzinei 9, băile herculane 325200, romania"
"439","Nera Gorge-Beusnita ",2000,"368","Romania","The Banat","Timisoara",105,"Nera Gorge-Beusnita  National Park, Romania",21.8877902,44.9558443,"cheile nerei-beușnița national park, romania"
"440","Retezat ",2000,"380","Romania","Transylvania","Timisoara",223,"Retezat  National Park, Romania",22.882143,45.3818438,"retezat national park, nr. 284 com, nucșoara 337423, romania"
"441","Rodna Mountains ",2000,"466","Romania","Maramures","Baia Mare",123,"Rodna Mountains  National Park, Romania",24.7202975,47.5596519,"rodnei mountains national park, romania"
"442","Semenic-Caras Gorge ",2000,"357","Romania","The Banat","Timisoara",131,"Semenic-Caras Gorge  National Park, Romania",21.961281,45.1563939,"semenic - cheile carasului national park, romania"
"443","Buila-Vanturarita ",2005,"42","Romania","Wallachia","Pitesti",94,"Buila-Vanturarita  National Park, Romania",24.094346,45.2458795,"buila vânturarița national park, romania"
"444","Defileul Jiului ",2005,"111","Romania","Transylvania","Sibiu",199,"Defileul Jiului  National Park, Romania",23.3819085,45.3145242,"defileul jiului national park, strada zorilor 6, bumbești-jiu 215100, romania"
"445","Fruska Gora ",1960,"254","Serbia","Northern Serbia","Novi Sad",22,"Fruska Gora  National Park, Serbia",19.7444027,45.15614,"fruška gora national park, zmajev trg 1, čerević 21208, serbia"
"446","Djerdap",1974,"637","Serbia","Eastern Serbia","Belgrade",131,"Djerdap National Park, Serbia",21.9802686,44.5289598,"djerdap national park, serbia"
"447","Kopaonik ",1981,"118","Serbia","Southern Serbia","Pristina",236,"Kopaonik  National Park, Serbia",20.7985117,43.2761907,"kopaonik national park, kopaonička, serbia"
"448","Tara",1981,"192","Serbia","Western Serbia","Sarajevo ",155,"Tara National Park, Serbia",19.459444,43.848333,"tara, mokra gora, serbia"
"449","Tatra",1949,"703","Slovakia","Northern Slovakia","Kosice",136,"Tatra National Park, Slovakia",20.0984208,49.1417445,"tatra national park, 062 01 vysoké tatry, slovakia"
"450","Pieniny",1967,"38","Slovakia","Northern Slovakia","Kosice",122,"Pieniny National Park, Slovakia",20.5061033,49.3872818,"pieniny national park, 543 51, 059 06 červený kláštor, slovakia"
"451","Low Tatras",1978,"728","Slovakia","Central Slovakia","Kosice",132,"Low Tatras National Park, Slovakia",19.2298088,48.8889691,"low tatras national park, 974 01 banská bystrica, slovakia"
"452","Mala Fatra ",1988,"226","Slovakia","Central Slovakia","Ostrava",117,"Mala Fatra  National Park, Slovakia",19.0611785,49.2512161,"malá fatra, slovakia"
"453","Poloniny",1997,"298","Slovakia","Northeastern Slovakia","Uzzhorod",84,"Poloniny National Park, Slovakia",22.4098853,49.0544125,"poloniny national park, rybnícka 3951, 069 01 snina, slovakia"
"454","Muranska Planina ",1998,"203","Slovakia","Central Slovakia","Kosice",123,"Muranska Planina  National Park, Slovakia",20.0211046,48.7722487,"národný park muránska planina, slovakia"
"455","Slovak Paradise ",1998,"198","Slovakia","Eastern Slovakia","Kosice",81,"Slovak Paradise  National Park, Slovakia",20.2406407,48.9377255,"slovak paradise national park, slovakia"
"456","Slovak Karst ",2002,"346","Slovakia","Southeastern Slovakia","Kosice",68,"Slovak Karst  National Park, Slovakia",20.53339,48.6121142,"slovak karst, hámosiho 188, 049 51 brzotín, slovakia"
"457","Vel’ka Fatra ",2002,"404","Slovakia","Central Slovakia","Ostrava",147,"Vel’ka Fatra  National Park, Slovakia",19.0883697,49.0096045,"veľká fatra national park, slovakia"
"458","Ordesa y Monte Perdido ",1918,"156","Spain","Aragon","Zaragoza",165,"Ordesa y Monte Perdido  National Park, Spain",0.0349001,42.6468705,"ordesa y monte perdido national park, huesca, spain"
"459","Picos de Europa ",1918,"671","Spain","Cantabria and Asturias","Oviedo",81,"Picos de Europa  National Park, Spain",-4.8712433,43.1869684,"parque nacional de los picos de europa, asturias, spain"
"460","Aiguestortes i Estany de Sant Maurici ",1955,"141","Spain","Catalunya","Lleida",151,"Aiguestortes i Estany de Sant Maurici  National Park, Spain",0.9324087,42.5719788,"aigüestortes i estany of saint maurici national park, lleida, spain"
"461","Donana",1969,"543","Spain","Andalucia","Huelva",63,"Donana National Park, Spain",-6.4344467,37.0427289,"doñana national park, almonte, huelva, spain"
"462","Tablas de Daimiel ",1973,"30","Spain","New Castile and Extremadura","Madrid ",184,"Tablas de Daimiel  National Park, Spain",-3.6970369,39.1380283,"tablas daimiel, carr. a las tablas de daimiel, s/n, 13250 daimiel, ciudad real, spain"
"463","Cabaneros",1995,"409","Spain","New Castile and Extremadura","Madrid ",165,"Cabaneros National Park, Spain",-4.4931831,39.4007408,"cabañeros national park, cdad., 13110 horcajo de los montes, ciudad real, spain"
"464","Sierra Nevada ",1999,"859","Spain","Andalucia","Granada ",30,"Sierra Nevada  National Park, Spain",-3.1464992,37.0871121,"sierra nevada national park, ctra. antigua de sierra nevada, km. 7, 18196 sierra nevada, granada, spain"
"465","Illas Atlanticas de Galicia ",2002,"85","Spain","Galicia","Pontevedra",32,"Illas Atlanticas de Galicia  National Park, Spain",-8.9366865,42.3777191,"galician atlantic islands maritime-terrestrial national park, pontevedra, spain"
"466","Monfrague",2007,"184","Spain","New Castile and Extremadura","Madrid ",229,"Monfrague National Park, Spain",-5.9370734,39.813014,"monfragüe national park, 10695 villareal de san carlos, cáceres, spain"
"467","Sierra de Guadarrama ",2013,"340","Spain","Around Madrid","Madrid ",67,"Sierra de Guadarrama  National Park, Spain",-3.9614438,40.824722,"centro de visitantes peñalara, 40°49'28.5""n 3°57'41.5""w, 28741 rascafría, madrid, spain"
"468","Sierra de las Nieves ",2021,"230","Spain","Andalucia","Marbella",23,"Sierra de las Nieves  National Park, Spain",-4.9975534,36.6989771,"parque nacional sierra de las nieves, málaga, spain"
"469","Abisko",1909,"77","Sweden","Swedish Lapland","Oulu",581,"Abisko National Park, Sweden",18.685017,68.3187659,"abisko national park, kiruna, sweden"
"470","Angso",1909,"2","Sweden","Stockholm and Around","Stockholm",67,"Angso National Park, Sweden",18.7608066,59.6173057,"ängsö national park, stadsgården 22, 116 45 stockholm, sweden"
"471","Garphyttan",1909,"1","Sweden","The Southeast","Orebro ",22,"Garphyttan National Park, Sweden",14.8834032,59.2785032,"garphyttans nationalpark, unnamed road, 719 93 vintrosa, sweden"
"472","Gotska Sandon ",1909,"45","Sweden","The Southeast","Stockholm",127,"Gotska Sandon  National Park, Sweden",19.2576905,58.3523256,"gotska sandön, 624 65 fårösund, sweden"
"473","Hamra ",1909,"0.3","Sweden","The Bothnian Coast","Uppsala",331,"Hamra  National Park, Sweden",14.7575785,61.7639747,"hamra national park, 820 50 los, sweden"
"474","Pieljekaise",1909,"153","Sweden","Swedish Lapland","Trondheim",525,"Pieljekaise National Park, Sweden",16.7427266,66.3505662,"pieljekaise national park, sweden"
"475","Sanfjallet",1909,"103","Sweden","Central Sweden","Uppsala",445,"Sanfjallet National Park, Sweden",13.5833333,62.3,"sonfjället national park, sonfjället, sweden"
"476","Sarek",1909,"1970","Sweden","Swedish Lapland","Oulu",500,"Sarek National Park, Sweden",17.7,67.2833333,"sarek national park, sweden"
"477","Dalby Soderskog ",1918,"4","Sweden","The Southwest","Malmo",26,"Dalby Soderskog  National Park, Sweden",13.3300349,55.6762902,"dalby söderskog national park, 247 51 dalby, sweden"
"478","Vadvetjakka",1920,"26","Sweden","Swedish Lapland","Oulu",650,"Vadvetjakka National Park, Sweden",18.4345214,68.5398922,"vadvetjåkka national park, sweden"
"479","Bla Jungfrun ",1926,"2","Sweden","The Southeast","Linkoping",137,"Bla Jungfrun  National Park, Sweden",16.7937327,57.2537758,"blå jungfruns nationalpark, 387 72 oskarshamn, sweden"
"480","Norra Kvill ",1929,"1","Sweden","The Southeast","Linkoping",88,"Norra Kvill  National Park, Sweden",15.5938205,57.7629504,"norra kvills nationalpark, 598 72 gullringen, sweden"
"481","Tofsingdalen",1930,"16","Sweden","Central Sweden","Oslo",335,"Tofsingdalen National Park, Sweden",12.4504438,62.1669773,"töfsingdalen national park, 790 91 idre, sweden"
"482","Muddus",1942,"493","Sweden","Swedish Lapland","Oulu",380,"Muddus National Park, Sweden",20.2204814,66.9296773,"muddus national park, sweden"
"483","Padjelanta",1962,"1984","Sweden","Swedish Lapland","Trondheim",675,"Padjelanta National Park, Sweden",16.7132912,67.3736812,"padjelanta national park, sweden"
"484","Tiveden",1983,"14","Sweden","The Southeast","Orebro ",83,"Tiveden National Park, Sweden",14.6065028,58.7171092,"tiveden national park, tivedens nationalpark, tived, sweden"
"485","Skuleskogen",1984,"24","Sweden","The Bothnian Coast","Uppsala",434,"Skuleskogen National Park, Sweden",18.494087,63.1194909,"skuleskogen national park, kustvägen 31, 870 31 mjällom, sweden"
"486","Store Mosse ",1989,"79","Sweden","The Southeast","Jonkoping",64,"Store Mosse  National Park, Sweden",13.9298207,57.2999982,"greater mosse national park, store mosse nationalpark, 330 33 hillerstorp, sweden"
"487","Bjornlandet ",1991,"11","Sweden","Swedish Lapland","Trondheim",520,"Bjornlandet  National Park, Sweden",18.0553953,63.9712011,"björnlandets nationalpark, 919 93 fredrika, sweden"
"488","Djuro ",1991,"24","Sweden","Gothenburg and Around","Gothenburg",155,"Djuro  National Park, Sweden",13.4683508,58.86413,"djurö national park, 661 91 torsö, sweden"
"489","Tyresta",1993,"20","Sweden","Stockholm and Around","Stockholm",20,"Tyresta National Park, Sweden",18.2811826,59.1843103,"tyresta nationalpark och naturreservat, tyresta by 1, 136 59 vendelsö, sweden"
"490","Haparanda Archipelago ",1995,"60","Sweden","The Bothnian Coast","Oulu",101,"Haparanda Archipelago  National Park, Sweden",23.748206,65.577295,"haparanda archipelago national park, 953 95 seskarö, sweden"
"491","Tresticklan",1996,"29","Sweden","Gothenburg and Around","Gothenburg",179,"Tresticklan National Park, Sweden",11.7950483,59.043919,"tresticklan national park, lundby, sweden"
"492","Farnebofjarden",1998,"101","Sweden","Central Sweden","Uppsala",73,"Farnebofjarden National Park, Sweden",16.9087019,60.269924,"färnebofjärden national park, entrance, granövägen, 740 45 tärnsjö, sweden"
"493","Soderasen ",2001,"16","Sweden","The Southwest","Helsingborg",47,"Soderasen  National Park, Sweden",18.643501,60.128161,"sweden"
"494","Fulufjallet ",2002,"385","Sweden","Central Sweden","Oslo",295,"Fulufjallet  National Park, Sweden",12.7529779,61.5472905,"fulufjället national park, älvdalen, sweden"
"495","Kosterhavet ",2009,"398","Sweden","Gothenburg and Around","Gothenburg",166,"Kosterhavet  National Park, Sweden",11.03445,58.8371072,"kosterhavet national park, hamnevägen 30, ekenäs, sweden"
"496","Asnen",2018,"19","Sweden","The Southwest","Helsingborg",174,"Asnen National Park, Sweden",14.6500001,56.6166667,"åsnens nationalpark, strandvägen, 342 53 lönashult, sweden"
"497","Swiss ",1914,"172","Switzerland","Graubunden","Bolzano Bozen",116,"Swiss  National Park, Switzerland",10.2000257,46.6666261,"swiss national park, 7530 zernez, switzerland"
"498","Peak District ",1951,"1438","United Kingdom","W Midlands","Sheffield",23,"Peak District  National Park, United Kingdom",-1.7837383,53.3342499,"peak district national park, castleton, hope valley s33 8ws, uk"
"499","Lake District ",1951,"2292","United Kingdom","Cumbria and the Lakes","Newcastle",132,"Lake District  National Park, United Kingdom",-2.7974835,54.5772323,"lake district national park, cumbria, penrith ca10 2ql, uk"
"500","Snowdonia",1951,"2142","United Kingdom","Snowdonia and the Llyn","Liverpool",106,"Snowdonia National Park, United Kingdom",-3.8520817,52.898964,"snowdonia national park, blaenau ffestiniog ll41 4tr, uk"
"501","Dartmoor",1951,"856","United Kingdom","Devon and Cornwall","Plymouth",21,"Dartmoor National Park, United Kingdom",-3.9206884,50.5718857,"dartmoor national park, united kingdom"
"502","Pembrokeshire Coast ",1952,"620","United Kingdom","SW Wales","Swansea",105,"Pembrokeshire Coast  National Park, United Kingdom",-5.1011117,51.8120746,"pembrokeshire coast national park, united kingdom"
"503","North York Moors ",1952,"1436","United Kingdom","Yorkshire","Middlesborough",31,"North York Moors  National Park, United Kingdom",-0.892714,54.38716,"north york moors national park, united kingdom"
"504","Yorkshire Dales ",1954,"2179","United Kingdom","Yorkshire","Leeds",35,"Yorkshire Dales  National Park, United Kingdom",-2.1632062,54.1962686,"yorkshire dales national park, bainbridge, leyburn dl8 3el, uk"
"505","Exmoor",1954,"683","United Kingdom","Devon and Cornwall","Exeter",45,"Exmoor National Park, United Kingdom",-3.6462346,51.134614,"exmoor national park, dulverton ta22 9hl, uk"
"506","Northumberland",1956,"1049","United Kingdom","Northeast","Newcastle",39,"Northumberland National Park, United Kingdom",-2.2566844,55.3378051,"northumberland national park, united kingdom"
"507","Brecon Beacons ",1957,"1351","United Kingdom","Brecon Beacons and Powys","Cardiff",56,"Brecon Beacons  National Park, United Kingdom",-3.443504,51.8814731,"brecon beacons, brecon ld3 8nl, uk"
"508","The Broads ",1989,"303","United Kingdom","East Anglia","Norwich",19,"The Broads  National Park, United Kingdom",1.608883,52.604949,"the broads, thorpe rd, norwich nr1 1ry, uk"
"509","Loch Lomond and the Trossachs ",2002,"1865","United Kingdom","Stirling, Loch Lomond and the Trossachs","Glasgow",47,"Loch Lomond and the Trossachs  National Park, United Kingdom",-4.4720131,56.1487349,"loch lomond and the trossachs national park, stirling fk8, uk"
"510","Cairngorms",2003,"4528","United Kingdom","Cairngorms and Speyside","Dundee",51,"Cairngorms National Park, United Kingdom",-3.5615665,57.0492193,"cairngorms national park, grantown on spey ph26 3hg, uk"
"511","New Forest ",2005,"580","United Kingdom","Hampshire, Dorset and Wiltshire","Southampton",10,"New Forest  National Park, United Kingdom",-1.6312373,50.8764416,"new forest national park, united kingdom"
"512","South Downs ",2009,"1641","United Kingdom","Surrey, Kent and Sussex","Worthing",43,"South Downs  National Park, United Kingdom",-0.7380902,50.9892513,"south downs national park, north st, midhurst gu29 9dh, uk"
"513","Carpathian",1980,"503","Ukraine","Ivano-Frankivsk Oblast","Ivano-Frankivsk",93,"Carpathian National Park, Ukraine",25.5908974,47.2390429,"carpathian mountains"
"514","Shatsky",1983,"325","Ukraine","Volyn Oblast","Brest",99,"Shatsky National Park, Ukraine",23.859678,51.482778,"shatskyi national park, zhovtneva st, svitiaz', volyns'ka oblast, ukraine, 44021"
"515","Synevir ",1989,"404","Ukraine","Zakarpattia Oblast","Ivano-Frankivsk",165,"Synevir  National Park, Ukraine",23.684,48.617,"synevyr, zakarpattia oblast, ukraine"
"516","Uzhanian",1991,"382","Ukraine","Zakarpattia Oblast","Uzzhorod",71,"Uzhanian National Park, Ukraine",22.6751198,49.0022159,"uzhanskyi national park, н-13, великий березний, zakarpats'ka oblast, ukraine, 89000"
"517","Azov-Syvash ",1993,"522","Ukraine","Kherson Oblast","Melitpol",100,"Azov-Syvash  National Park, Ukraine",35.1128879,46.1426499,"azov-syvas'kyi national park, khersons'ka oblast, ukraine"
"518","Vyzhnytsia",1995,"79","Ukraine","Chernivtsi Oblast","Chernivtsi",65,"Vyzhnytsia National Park, Ukraine",25.2380182,48.1659463,"vyzhnytsia national park, chernivets'ka oblast, ukraine, 59209"
"519","Holy Mountains ",1997,"406","Ukraine","Donetsk Oblast","Slovyansk",14,"Holy Mountains  National Park, Ukraine",37.7516234,48.9510953,"sviati hory national park, donets'ka oblast, ukraine"
"520","Yavorivskyi ",1998,"71","Ukraine","Lviv Oblast","Lviv",49,"Yavorivskyi  National Park, Ukraine",23.7225758,49.9236992,"yavoriv national park, зелена 23, смт. івано-франкове, l'vivs'ka oblast, ukraine, 81070"
"521","Desna-Starogutsky ",1999,"162","Ukraine","Sumy Oblast","Bryansk",141,"Desna-Starogutsky  National Park, Ukraine",33.697539,52.3377732,"natsionalʹnyy pryrodnyy park ""desnyansʹko-starohut·sʹkyy"", національний природний парк “деснянсько-старогутський, seredyna-buda, sums'ka oblast, ukraine, 41020"
"522","Skole Beskids ",1999,"357","Ukraine","Lviv Oblast","Lviv",111,"Skole Beskids  National Park, Ukraine",23.5110466,49.0287995,"skolivski beskydy national park, skole, l'vivs'ka oblast, ukraine, 82600"
"523","Hutsulshchyna",2002,"323","Ukraine","Ivano-Frankivsk Oblast","Ivano-Frankivsk",95,"Hutsulshchyna National Park, Ukraine",24.9892825,48.330984,"hutsulshchyna national park, вулиця дружби, 84, kosiv, ivano-frankivs'ka oblast, ukraine, 78600"
"524","Halych",2004,"147","Ukraine","Ivano-Frankivsk Oblast","Ivano-Frankivsk",22,"Halych National Park, Ukraine",24.7313165,49.1237705,"halych, ivano-frankivsk oblast, ukraine"
"525","Homolsh Woods ",2004,"143","Ukraine","Kharkiv Oblast","Kharkiv ",52,"Homolsh Woods  National Park, Ukraine",36.2946031,49.5711618,"natsionalʹnyy pryrodnyy park ""homilʹshansʹki lisy"", зміївський район, kharkivs'ka oblast, ukraine, 63451"
"526","Ichnya ",2004,"97","Ukraine","Chernihiv Oblast","Brovary",133,"Ichnya  National Park, Ukraine",32.3974889,50.8579559,"ichnya, chernihiv oblast, ukraine, 16703"
"527","Great Meadow ",2006,"168","Ukraine","Zaporizhzhia Oblast","Zaporizhzhia",72,"Great Meadow  National Park, Ukraine",35.0718456,47.4289145,"great meadow national park, dniprorudne, zaporiz'ka oblast, ukraine, 71630"
"528","Mezynsky",2006,"310","Ukraine","Chernihiv Oblast","Chernihiv",149,"Mezynsky National Park, Ukraine",33.0244208,51.7166765,"mezynskyi national park, вул.корди, 84, radychiv, chernihivs'ka oblast, ukraine, 16215"
"529","Holosiivskyi",2007,"45","Ukraine","Kyiv Oblast","Kyiv",0,"Holosiivskyi National Park, Ukraine",31.16558,48.379433,"ukraine"
"530","Prypiat-Stokhid ",2007,"393","Ukraine","Volyn Oblast","Lutsk",159,"Prypiat-Stokhid  National Park, Ukraine",25.6128202,51.8810262,"pripiat-stokhid national park, смт, вулиця бондаренка, 47, lyubeshiv, volyns'ka oblast, ukraine, 44200"
"531","Lower Dniester ",2008,"213","Ukraine","Odessa Oblast","Odessa",41,"Lower Dniester  National Park, Ukraine",30.2279265,46.4134002,"lower dniester national park, е 87, maiaky, odes'ka oblast, ukraine"
"532","Buzk’s Gard ",2009,"61","Ukraine","Mykolaiv Oblast","Kropyvnytskyi ",120,"Buzk’s Gard  National Park, Ukraine",31.16558,48.379433,"ukraine"
"533","Charming Harbor ",2009,"63","Ukraine","Crimea","Yevpatoroya",101,"Charming Harbor  National Park, Ukraine",32.5847032,45.3576615,"charming harbor national park, улица кирова, 6а, черноморское"
"534","Cheremosh",2009,"71","Ukraine","Chernivtsi Oblast","Chernivtsi",121,"Cheremosh National Park, Ukraine",25.0974541,47.9949749,"natsionalʹnyy pryrodnyy park ""cheremosʹkyy"", українська вул. 174, putyla, chernivets'ka oblast, ukraine, 59100"
"535","Derman-Ostroh ",2009,"16","Ukraine","Rivne Oblast","Rivne",44,"Derman-Ostroh  National Park, Ukraine",26.2127997,50.2892135,"derman-ostrog national park, вулиця князів острозьких, 3а, ostroh, rivnens'ka oblast, ukraine, 35800"
